ID,ID_incident,date_published,data_source,data_source_name,data_source_country,source_type,alert_type,raw_text_product,product_categoty,product,origin_country,origin_country_EU,notified_country,notified_country_EU,hazard_description,hazard_group,summary,food_feed_fcm,date_published_year,date_published_month,date_published_year_month,date_published_quarter,date_published_year_quarter,date_published_fulltime,alert_type_large,long.origin,lat.origin,long.notified,lat.notified,long.origin.rand,lat.origin.rand,long.notified.rand,lat.notified.rand,contaminant,contaminant2
120061,120061,2018-08-02,RASFF Portal,RASFF Portal,EU,Official,alert,plastic fragments in canned chopped tomatoes in tomato juice with basil from Italy,fruits and vegetables,tomato,Italy,EU,Germany,EU,plastic fragments,foreign bodies,plastic fragments: canned chopped tomatoes in tomato juice with basil,food,2018,08,2018-08,Q3,2018-Q3,2018-08-02 00:00:00 +00:00,alert,12.07000946,42.79663568,10.38577693,51.10697903,7.261795213231175,45.3494613127704,11.48773996452439,51.13944776055378,plastic,plastic
120084,120084,2018-07-31,RASFF Portal,RASFF Portal,EU,Official,alert,foreign body (fragment of skin with animal fur) in frozen meat balls from Poland,meat and meat products (other than poultry),meat ball,Poland,EU,Poland,EU,foreign body,foreign bodies,foreign body: frozen meat balls,food,2018,07,2018-07,Q3,2018-Q3,2018-07-31 00:00:00 +00:00,alert,19.39011841,52.12759537,19.39011841,52.12759537,23.24021682672073,50.66214556589393,19.455549073067576,53.8052842535323,other foreign body,other foreign body
120118,120118,2018-07-27,RASFF Portal,RASFF Portal,EU,Official,alert,plastic particles in frozen chicken nuggets from France,poultry meat and poultry meat products,meat product,France,EU,France,EU,plastic particles,foreign bodies,plastic particles: frozen chicken nuggets,food,2018,07,2018-07,Q3,2018-Q3,2018-07-27 00:00:00 +00:00,alert,2.53618475,46.18700581,2.53618475,46.18700581,1.9522943771437733,48.56138936139624,5.2648998704622,44.144278303490204,plastic,plastic
120119,120119,2018-07-27,RASFF Portal,RASFF Portal,EU,Official,alert,metal fragments (2.5 cm x 1 mm) in chilled precooked pasta lunch box from France,cereals and bakery products,chilled precooked pasta lunch box,France,EU,France,EU,metal fragments,foreign bodies,metal fragments: chilled precooked pasta lunch box,food,2018,07,2018-07,Q3,2018-Q3,2018-07-27 00:00:00 +00:00,alert,2.53618475,46.18700581,2.53618475,46.18700581,7.272203292190568,49.06822416422413,3.708610090839752,45.0442833009318,metal,metal
120120,120120,2018-07-27,RASFF Portal,RASFF Portal,EU,Official,information for follow-up,foreign body (piece of rubber) in potato salad from Germany,prepared dishes and snacks,potato,Germany,EU,Germany,EU,foreign body,foreign bodies,foreign body: potato salad,food,2018,07,2018-07,Q3,2018-Q3,2018-07-27 00:00:00 +00:00,update,10.38577693,51.10697903,10.38577693,51.10697903,8.100820368665975,49.86022926383992,12.300020120506705,50.91172314241189,plastic,plastic
120155,120155,2018-07-25,RASFF Portal,RASFF Portal,EU,Official,information for attention,metal wires in milk powder used to produce ice cream from Finland,milk and milk products,milk powder ice cream,Finland,EU,Finland,EU,metal wires,foreign bodies,metal wires: milk powder used to produce ice cream,food,2018,07,2018-07,Q3,2018-Q3,2018-07-25 00:00:00 +00:00,information for attention,26.27467024,64.49884844,26.27467024,64.49884844,27.968863230355325,69.6476824984178,26.205254820982624,64.78511745701174,metal,metal
120169,120169,2018-07-24,RASFF Portal,RASFF Portal,EU,Official,alert,metal wires (length below 1.5 cm) in lactose-free milk powders from Finland,milk and milk products,lactose milk powder,Finland,EU,Finland,EU,metal wires,foreign bodies,metal wires: lactosefree milk powders,food,2018,07,2018-07,Q3,2018-Q3,2018-07-24 00:00:00 +00:00,alert,26.27467024,64.49884844,26.27467024,64.49884844,28.52077146049715,67.93663421504803,21.91559323951785,68.68571667972273,metal,metal
120186,120186,2018-07-23,RASFF Portal,RASFF Portal,EU,Official,alert,foreign body (hard plastic pieces) in mushrooms from the Netherlands,fruits and vegetables,mushroom,Netherlands,EU,France,EU,foreign body,foreign bodies,foreign body: mushrooms,food,2018,07,2018-07,Q3,2018-Q3,2018-07-23 00:00:00 +00:00,alert,5.2814735,52.10080804,2.53618475,46.18700581,5.3021841987853655,51.686597704175696,4.6069114494797905,48.41655844891106,plastic,plastic
120198,120198,2018-07-20,RASFF Portal,RASFF Portal,EU,Official,alert,metal fragments (2-5 mm) in organic coconut flour from Sri Lanka,nuts; nut products and seeds,coconut,Sri Lanka,non_EU,Netherlands,EU,metal fragments,foreign bodies,metal fragments: organic coconut flour,food,2018,07,2018-07,Q3,2018-Q3,2018-07-20 00:00:00 +00:00,alert,80.70107795,7.61266309,5.2814735,52.10080804,80.2767347279426,6.908357376937328,5.533888935861182,51.75686264914141,metal,metal
120231,120231,2018-07-18,RASFF Portal,RASFF Portal,EU,Official,alert,foreign body (small piece of nylon) in mini bread rolls from the United Kingdom,cereals and bakery products,bakery product,United Kingdom,UK,United Kingdom,UK,foreign body,foreign bodies,foreign body: mini bread rolls,food,2018,07,2018-07,Q3,2018-Q3,2018-07-18 00:00:00 +00:00,alert,-2.86563362,54.12387156,-2.86563362,54.12387156,-4.791311225785071,57.6565745861227,-3.9676582910809213,50.29820143719286,other foreign body,other foreign body
120345,120345,2018-07-10,RASFF Portal,RASFF Portal,EU,Official,border rejection,foreign body (filamentous structures of non-animal origin) in fish meal from Mauritius,feed materials,fish meal,Mauritius,non_EU,Italy,EU,foreign body,foreign bodies,foreign body: fish meal,feed,2018,07,2018-07,Q3,2018-Q3,2018-07-10 00:00:00 +00:00,border rejection,57.57120758,-20.2777156,12.07000946,42.79663568,63.46087875827756,-19.72109486327457,13.098642178084914,42.951768401598315,other foreign body,other foreign body
120361,120361,2018-07-09,RASFF Portal,RASFF Portal,EU,Official,information for follow-up,possible presence of glass and of plastic in frozen dumplings from Germany,cereals and bakery products,dumpling,Germany,EU,Germany,EU,possible presence of glass,foreign bodies,possible presence of glass: frozen dumplings,food,2018,07,2018-07,Q3,2018-Q3,2018-07-09 00:00:00 +00:00,update,10.38577693,51.10697903,10.38577693,51.10697903,11.622958728788024,52.13976148198623,11.345650265244815,53.474196787699015,plastic,plastic
120442,120442,2018-06-29,RASFF Portal,RASFF Portal,EU,Official,alert,plastic fragments in ice cream from Belgium,ices and desserts,ice cream,Belgium,EU,Denmark,EU,plastic fragments,foreign bodies,plastic fragments: ice cream,food,2018,06,2018-06,Q2,2018-Q2,2018-06-29 00:00:00 +00:00,alert,4.64064572,50.63981435,10.02799418,55.98126391,5.446321549529122,51.199976847066345,12.29592883651173,55.89767907893404,plastic,plastic
120444,120444,2018-06-29,RASFF Portal,RASFF Portal,EU,Official,information for follow-up,organic whole wheat flour and organic whole wheat spelt flour from Germany infested with larvae of insects,cereals and bakery products,wheat,Germany,EU,Denmark,EU,insects,foreign bodies,insects: organic whole wheat flour and organic whole wheat spelt flour,food,2018,06,2018-06,Q2,2018-Q2,2018-06-29 00:00:00 +00:00,update,10.38577693,51.10697903,10.02799418,55.98126391,10.106081765375235,48.59448711048776,9.043780335938022,56.38234206223669,insects,insects
120458,120458,2018-06-28,RASFF Portal,RASFF Portal,EU,Official,alert,glass fragments in fish; soy and teriyaki sauces from Malaysia,fish and fish products,fish soy teriyaki sauce,Malaysia,non_EU,Austria,EU,glass fragments,foreign bodies,glass fragments: fish soy and teriyaki sauces,food,2018,06,2018-06,Q2,2018-Q2,2018-06-28 00:00:00 +00:00,alert,109.69761552,3.78987255,14.12647809,47.58549847,109.78865882221024,1.5364161441478164,12.889785478890953,47.56153651119073,glass,glass
120459,120459,2018-06-28,RASFF Portal,RASFF Portal,EU,Official,alert,glass fragments (0.5-1.5 mm) in soy sauce from Malaysia,soups; broths; sauces and condiments,soy sauce,Malaysia,non_EU,United Kingdom,UK,glass fragments,foreign bodies,glass fragments: soy sauce,food,2018,06,2018-06,Q2,2018-Q2,2018-06-28 00:00:00 +00:00,alert,109.69761552,3.78987255,-2.86563362,54.12387156,111.81977082716693,1.642765718108885,-2.9151445561200986,56.576083514791776,glass,glass
120541,120541,2018-06-21,RASFF Portal,RASFF Portal,EU,Official,alert,metal fragments (10x3 mm; 15x11 mm; 10x4 mm) in cat food from Germany,pet food,pet food,Germany,EU,Sweden,EU,metal fragments,foreign bodies,metal fragments: cat food,feed,2018,06,2018-06,Q2,2018-Q2,2018-06-21 00:00:00 +00:00,alert,10.38577693,51.10697903,16.74371219,62.79232016,7.9208456457476295,52.073839497320826,23.106332918475093,66.1987454596483,metal,metal
120543,120543,2018-06-21,RASFF Portal,RASFF Portal,EU,Official,border rejection,foreign body (fine white powder) in frozen smoked haddock from China,fish and fish products,cod,China,non_EU,United Kingdom,UK,foreign body,foreign bodies,foreign body: frozen smoked haddock,food,2018,06,2018-06,Q2,2018-Q2,2018-06-21 00:00:00 +00:00,border rejection,103.81907385,36.56176801,-2.86563362,54.12387156,106.75566096517824,36.90568098938043,-3.939485132316151,52.63226809314253,other foreign body,other foreign body
120567,120567,2018-06-19,RASFF Portal,RASFF Portal,EU,Official,alert,metal fragments in candies from Sweden,confectionery,candy,Sweden,EU,Sweden,EU,metal fragments,foreign bodies,metal fragments: candies,food,2018,06,2018-06,Q2,2018-Q2,2018-06-19 00:00:00 +00:00,alert,16.74371219,62.79232016,16.74371219,62.79232016,20.350684442268346,68.14078233841354,16.397846315605623,63.88727782246343,metal,metal
120575,120575,2018-06-18,RASFF Portal,RASFF Portal,EU,Official,alert,glass particles in shrimp chicken nems from France; via the Netherlands,poultry meat and poultry meat products,shrimp,France,EU,Belgium,EU,glass particles,foreign bodies,glass particles: shrimp chicken nems,food,2018,06,2018-06,Q2,2018-Q2,2018-06-18 00:00:00 +00:00,alert,2.53618475,46.18700581,4.64064572,50.63981435,5.03909443074147,43.90233782268089,4.802909642368046,51.145991738399346,glass,glass
120576,120576,2018-06-18,RASFF Portal,RASFF Portal,EU,Official,information for follow-up,plastic particles (soft blue) in sausages from Poland,meat and meat products (other than poultry),meat product,Poland,EU,Denmark,EU,plastic particles,foreign bodies,plastic particles: sausages,food,2018,06,2018-06,Q2,2018-Q2,2018-06-18 00:00:00 +00:00,update,19.39011841,52.12759537,10.02799418,55.98126391,15.32518703898757,51.365419029981574,10.197355705269775,57.22916094015537,plastic,plastic
120599,120599,2018-06-14,RASFF Portal,RASFF Portal,EU,Official,information for attention,foreign body (metal piece) in mozzarella from Germany,milk and milk products,mozzarella,Germany,EU,Italy,EU,foreign body,foreign bodies,foreign body: mozzarella,food,2018,06,2018-06,Q2,2018-Q2,2018-06-14 00:00:00 +00:00,information for attention,10.38577693,51.10697903,12.07000946,42.79663568,10.212666963163683,48.97202207127491,7.29109668906325,45.60022485010937,metal,metal
120607,120607,2018-06-14,RASFF Portal,RASFF Portal,EU,Official,information for follow-up,dried figs from Turkey infested with larvae of insects,fruits and vegetables,fig,Turkey,non_EU,Italy,EU,insects,foreign bodies,insects: dried figs,food,2018,06,2018-06,Q2,2018-Q2,2018-06-14 00:00:00 +00:00,update,35.16895529,39.06160342,12.07000946,42.79663568,43.01302255606633,40.58955560965861,12.307344003278654,45.75816201702847,insects,insects
120647,120647,2018-06-12,RASFF Portal,RASFF Portal,EU,Official,alert,metal pieces (up to 5 mm) in organic dates pastes from Saudi Arabia,fruits and vegetables,date paste,Saudi Arabia,non_EU,Netherlands,EU,metal pieces,foreign bodies,metal pieces: organic dates pastes,food,2018,06,2018-06,Q2,2018-Q2,2018-06-12 00:00:00 +00:00,alert,44.53687041,24.12245467,5.2814735,52.10080804,40.05976198568406,21.23678787173992,5.448891535612596,52.50428644566166,metal,metal
120695,120695,2018-06-07,RASFF Portal,RASFF Portal,EU,Official,alert,glass fragments in chili con carne in jars from France,meat and meat products (other than poultry),pepper,France,EU,France,EU,glass fragments,foreign bodies,glass fragments: chili con carne in jars,food,2018,06,2018-06,Q2,2018-Q2,2018-06-07 00:00:00 +00:00,alert,2.53618475,46.18700581,2.53618475,46.18700581,0.9890017138994169,47.928477869166144,2.153191664073689,50.05916780356978,glass,glass
120737,120737,2018-06-04,RASFF Portal,RASFF Portal,EU,Official,information for follow-up,plastic fragments in white chocolate bar from the Netherlands,confectionery,white chocolate bar,Netherlands,EU,Netherlands,EU,plastic fragments,foreign bodies,plastic fragments: white chocolate bar,food,2018,06,2018-06,Q2,2018-Q2,2018-06-04 00:00:00 +00:00,update,5.2814735,52.10080804,5.2814735,52.10080804,5.49566394053549,51.87615618818129,5.658959392916863,52.353026845918436,plastic,plastic
120751,120751,2018-06-01,RASFF Portal,RASFF Portal,EU,Official,alert,plastic fragments in chicken sausages from Germany,poultry meat and poultry meat products,meat product,Germany,EU,Germany,EU,plastic fragments,foreign bodies,plastic fragments: chicken sausages,food,2018,06,2018-06,Q2,2018-Q2,2018-06-01 00:00:00 +00:00,alert,10.38577693,51.10697903,10.38577693,51.10697903,10.165909545309452,51.34679432992022,12.120239590740162,50.53487609235679,plastic,plastic
120814,120814,2018-05-25,RASFF Portal,RASFF Portal,EU,Official,alert,metal fragments in organic nougat cream with coconut from Germany; with raw material from Indonesia,nuts; nut products and seeds,coconut,Germany,EU,Germany,EU,metal fragments,foreign bodies,metal fragments: organic nougat cream with coconut,food,2018,05,2018-05,Q2,2018-Q2,2018-05-25 00:00:00 +00:00,alert,10.38577693,51.10697903,10.38577693,51.10697903,8.963917258019805,47.92280651261072,12.614272924683698,48.58280623615891,metal,metal
120817,120817,2018-05-25,RASFF Portal,RASFF Portal,EU,Official,alert,glass fragments in organic apricot jam from France,confectionery,apricot,France,EU,France,EU,glass fragments,foreign bodies,glass fragments: organic apricot jam,food,2018,05,2018-05,Q2,2018-Q2,2018-05-25 00:00:00 +00:00,alert,2.53618475,46.18700581,2.53618475,46.18700581,-0.03529776007760521,45.93629892864624,0.9753102013349233,47.915584538517216,glass,glass
120901,120901,2018-05-18,RASFF Portal,RASFF Portal,EU,Official,border rejection,foreign body (filamentous structures of non-animal origin) in fish meal from Chile,feed materials,fish meal,Chile,non_EU,Italy,EU,foreign body,foreign bodies,foreign body: fish meal,feed,2018,05,2018-05,Q2,2018-Q2,2018-05-18 00:00:00 +00:00,border rejection,-71.38255879,-37.73069754,12.07000946,42.79663568,-74.28589218206606,-51.00985265527824,12.549076721610373,43.13687642071818,other foreign body,other foreign body
120902,120902,2018-05-18,RASFF Portal,RASFF Portal,EU,Official,border rejection,foreign body (filamentous structures of non-animal origin) in fish meal from Chile,feed materials,fish meal,Chile,non_EU,Italy,EU,foreign body,foreign bodies,foreign body: fish meal,feed,2018,05,2018-05,Q2,2018-Q2,2018-05-18 00:00:00 +00:00,border rejection,-71.38255879,-37.73069754,12.07000946,42.79663568,-72.47643484345201,-36.926446546279564,18.012153744283776,40.31929182713557,other foreign body,other foreign body
120923,120923,2018-05-17,RASFF Portal,RASFF Portal,EU,Official,border rejection,foreign body (filamentous structures of non-animal origin) in fish meal from Chile,feed materials,fish meal,Chile,non_EU,Italy,EU,foreign body,foreign bodies,foreign body: fish meal,feed,2018,05,2018-05,Q2,2018-Q2,2018-05-17 00:00:00 +00:00,border rejection,-71.38255879,-37.73069754,12.07000946,42.79663568,-74.39262058039554,-50.53480585756244,10.666144397419831,45.061892596894204,other foreign body,other foreign body
120939,120939,2018-05-16,RASFF Portal,RASFF Portal,EU,Official,information for follow-up,plastic fragments (white synthetic bristles thickness: 0.2 mm; length 0.5-3 cm) in chocolate bars from Belgium,cocoa and cocoa preparations; coffee and tea,chocolate bar,Belgium,EU,Netherlands,EU,plastic fragments,foreign bodies,plastic fragments: chocolate bars,food,2018,05,2018-05,Q2,2018-Q2,2018-05-16 00:00:00 +00:00,update,4.64064572,50.63981435,5.2814735,52.10080804,5.90781889528105,50.182377077968034,6.604960169900817,53.00625893642614,plastic,plastic
121001,121001,2018-05-09,RASFF Portal,RASFF Portal,EU,Official,alert,foreign body (white plastic/rubber texture: 0.5 x 0.5 cm) in breakfast cereals from France,cereals and bakery products,breakfast cereal,France,EU,Belgium,EU,foreign body,foreign bodies,foreign body: breakfast cereals,food,2018,05,2018-05,Q2,2018-Q2,2018-05-09 00:00:00 +00:00,alert,2.53618475,46.18700581,4.64064572,50.63981435,2.491093644991003,47.7872759949201,3.6368524519419836,51.17243520926545,plastic,plastic
121002,121002,2018-05-09,RASFF Portal,RASFF Portal,EU,Official,information for follow-up,plastic fragments in organic sesame seeds from Switzerland,nuts; nut products and seeds,sesame,Switzerland,non_EU,Switzerland,non_EU,plastic fragments,foreign bodies,plastic fragments: organic sesame seeds,food,2018,05,2018-05,Q2,2018-Q2,2018-05-09 00:00:00 +00:00,update,8.20866006,46.79785296,8.20866006,46.79785296,8.804163755528455,46.31827009363733,10.253166681236973,46.59081041718149,plastic,plastic
121061,121061,2018-05-04,RASFF Portal,RASFF Portal,EU,Official,information for follow-up,dried figs from Greece infested with larvae of insects,fruits and vegetables,fig,Greece,EU,Italy,EU,insects,foreign bodies,insects: dried figs,food,2018,05,2018-05,Q2,2018-Q2,2018-05-04 00:00:00 +00:00,update,22.95556207,39.07466973,12.07000946,42.79663568,25.98586473548515,40.77341567696572,8.68082013754546,45.87950033145343,insects,insects
121105,121105,2018-04-30,RASFF Portal,RASFF Portal,EU,Official,alert,glass fragments in honey from France,honey and royal jelly,honey,France,EU,France,EU,glass fragments,foreign bodies,glass fragments: honey,food,2018,04,2018-04,Q2,2018-Q2,2018-04-30 00:00:00 +00:00,alert,2.53618475,46.18700581,2.53618475,46.18700581,-1.0002098987637509,44.47723474730629,1.1547699959627344,49.91403282952055,glass,glass
121112,121112,2018-04-30,RASFF Portal,RASFF Portal,EU,Official,alert,sharp fragments in garlic bread and pestobread from Germany,fruits and vegetables,bakery product,Germany,EU,Germany,EU,sharp fragments,foreign bodies,sharp fragments: garlic bread and pestobread,food,2018,04,2018-04,Q2,2018-Q2,2018-04-30 00:00:00 +00:00,alert,10.38577693,51.10697903,10.38577693,51.10697903,8.502946114301372,48.3779224496577,11.555877863035407,53.968113987627916,metal,metal
121141,121141,2018-04-26,RASFF Portal,RASFF Portal,EU,Official,border rejection,foreign body (filamentous structures of non-animal origin) in fish meal from Mauritius,feed materials,fish meal,Mauritius,non_EU,Italy,EU,foreign body,foreign bodies,foreign body: fish meal,feed,2018,04,2018-04,Q2,2018-Q2,2018-04-26 00:00:00 +00:00,border rejection,57.57120758,-20.2777156,12.07000946,42.79663568,57.40930956283255,-20.30588800939895,11.961227113405661,45.936410531112784,other foreign body,other foreign body
121142,121142,2018-04-26,RASFF Portal,RASFF Portal,EU,Official,alert,plastic fragments (sharp) in falafel and hummus wraps from the Netherlands,prepared dishes and snacks,hummus,Netherlands,EU,Netherlands,EU,plastic fragments,foreign bodies,plastic fragments: falafel and hummus wraps,food,2018,04,2018-04,Q2,2018-Q2,2018-04-26 00:00:00 +00:00,alert,5.2814735,52.10080804,5.2814735,52.10080804,5.891207453522398,52.594378704627346,6.523097964223517,52.37940944875629,plastic,plastic
121153,121153,2018-04-25,RASFF Portal,RASFF Portal,EU,Official,border rejection,foreign body (filamentous structures of non-animal origin) in fish meal from Chile,feed materials,fish meal,Chile,non_EU,Italy,EU,foreign body,foreign bodies,foreign body: fish meal,feed,2018,04,2018-04,Q2,2018-Q2,2018-04-25 00:00:00 +00:00,border rejection,-71.38255879,-37.73069754,12.07000946,42.79663568,-73.94978814475462,-43.815954873744396,11.810111492128605,44.049494799939076,other foreign body,other foreign body
121287,121287,2018-04-13,RASFF Portal,RASFF Portal,EU,Official,alert,glass fragments in fish soup in glass jar from France,fish and fish products,fish soup glass jar,France,EU,Germany,EU,glass fragments,foreign bodies,glass fragments: fish soup in glass jar,food,2018,04,2018-04,Q2,2018-Q2,2018-04-13 00:00:00 +00:00,alert,2.53618475,46.18700581,10.38577693,51.10697903,-1.1779164452399402,44.78812765184462,9.115498421464629,53.11053261185888,glass,glass
121309,121309,2018-04-12,RASFF Portal,RASFF Portal,EU,Official,alert,metal wires in cottage cheese from Germany,milk and milk products,cheese,Germany,EU,Germany,EU,metal wires,foreign bodies,metal wires: cottage cheese,food,2018,04,2018-04,Q2,2018-Q2,2018-04-12 00:00:00 +00:00,alert,10.38577693,51.10697903,10.38577693,51.10697903,8.263873068987902,48.543064901292716,14.551728636289088,51.68737023785745,metal,metal
121317,121317,2018-04-12,RASFF Portal,RASFF Portal,EU,Official,information for attention,organic gluten free porridge flakes packaged in the Netherlands infested with insects,cereals and bakery products,gluten porridge flake,Netherlands,EU,United Kingdom,UK,infested with insects,foreign bodies,infested with insects: organic gluten free porridge flakes,food,2018,04,2018-04,Q2,2018-Q2,2018-04-12 00:00:00 +00:00,information for attention,5.2814735,52.10080804,-2.86563362,54.12387156,5.653595232495999,51.98024040130243,-0.8892408394399389,51.072620465693426,insects,insects
121337,121337,2018-04-11,RASFF Portal,RASFF Portal,EU,Official,alert,foreign body (metal) in complementary pet food from Italy,pet food,pet food,Italy,EU,Italy,EU,foreign body,foreign bodies,foreign body: complementary pet food,feed,2018,04,2018-04,Q2,2018-Q2,2018-04-11 00:00:00 +00:00,alert,12.07000946,42.79663568,12.07000946,42.79663568,13.5525547312705,45.69581798509215,16.535042652841938,39.34018101595822,metal,metal
121379,121379,2018-04-06,RASFF Portal,RASFF Portal,EU,Official,alert,glass fragments in infant milk from Germany; packaged in Austria,milk and milk products,infant milk,Austria,EU,Slovenia,EU,glass fragments,foreign bodies,glass fragments: infant milk,food,2018,04,2018-04,Q2,2018-Q2,2018-04-06 00:00:00 +00:00,alert,14.12647809,47.58549847,14.8044464,46.11555444,15.472250244934578,48.09155639481347,15.231166461241878,46.031284025195504,glass,glass
121388,121388,2018-04-05,RASFF Portal,RASFF Portal,EU,Official,alert,glass fragments in bottled beer from Belgium,alcoholic beverages,beer,Belgium,EU,Belgium,EU,glass fragments,foreign bodies,glass fragments: bottled beer,food,2018,04,2018-04,Q2,2018-Q2,2018-04-05 00:00:00 +00:00,alert,4.64064572,50.63981435,4.64064572,50.63981435,6.19823252794891,50.414972165056184,6.27828527476906,50.34049651887816,glass,glass
121455,121455,2018-03-28,RASFF Portal,RASFF Portal,EU,Official,alert,glass fragments in glass jars containing peach Melba from Germany,fruits and vegetables,peach,Germany,EU,Germany,EU,glass fragments,foreign bodies,glass fragments: glass jars containing peach melba,food,2018,03,2018-03,Q1,2018-Q1,2018-03-28 00:00:00 +00:00,alert,10.38577693,51.10697903,10.38577693,51.10697903,9.215920610078262,52.37898612089202,9.916914023897544,51.493446667820386,glass,glass
121476,121476,2018-03-27,RASFF Portal,RASFF Portal,EU,Official,alert,foreign body (corn shells) in frozen corn puree from Sweden,fruits and vegetables,corn,Sweden,EU,Sweden,EU,foreign body,foreign bodies,foreign body: frozen corn puree,food,2018,03,2018-03,Q1,2018-Q1,2018-03-27 00:00:00 +00:00,alert,16.74371219,62.79232016,16.74371219,62.79232016,12.024475630091851,58.38281915643069,22.807253712828384,66.69468107106373,other foreign body,other foreign body
121501,121501,2018-03-23,RASFF Portal,RASFF Portal,EU,Official,information for follow-up,foreign body (capsule) in fruit juice from the Netherlands,fruits and vegetables,fruit juice,Netherlands,EU,Belgium,EU,foreign body,foreign bodies,foreign body: fruit juice,food,2018,03,2018-03,Q1,2018-Q1,2018-03-23 00:00:00 +00:00,update,5.2814735,52.10080804,4.64064572,50.63981435,4.450315494822249,51.85761792302348,3.2970382738366837,50.83849544399529,other foreign body,other foreign body
121502,121502,2018-03-23,RASFF Portal,RASFF Portal,EU,Official,alert,foreign body (shell fragments) in seaweed from France; packaged in Germany,fruits and vegetables,seaweed,France,EU,Austria,EU,foreign body,foreign bodies,foreign body: seaweed,food,2018,03,2018-03,Q1,2018-Q1,2018-03-23 00:00:00 +00:00,alert,2.53618475,46.18700581,14.12647809,47.58549847,5.4130054891473876,48.17965374343926,15.02682174332277,47.77456804973369,other foreign body,other foreign body
121517,121517,2018-03-22,RASFF Portal,RASFF Portal,EU,Official,alert,metal pieces in chilled quark cheese from Germany,milk and milk products,cheese,Germany,EU,Germany,EU,metal pieces,foreign bodies,metal pieces: chilled quark cheese,food,2018,03,2018-03,Q1,2018-Q1,2018-03-22 00:00:00 +00:00,alert,10.38577693,51.10697903,10.38577693,51.10697903,10.539794813024475,50.830005588632226,13.215785185242856,52.092821799626435,metal,metal
121524,121524,2018-03-22,RASFF Portal,RASFF Portal,EU,Official,information for follow-up,breakfast cereal from the Netherlands infested with larvae of insects,cereals and bakery products,breakfast cereal,Netherlands,EU,Spain,EU,insects,foreign bodies,insects: breakfast cereal,food,2018,03,2018-03,Q1,2018-Q1,2018-03-22 00:00:00 +00:00,update,5.2814735,52.10080804,-3.64754874,40.24448626,5.66511314816567,51.71430478099294,1.8714815098188993,42.1145211481087,insects,insects
